Question Number,Question
0,What is the difference between a stack and a queue?
1,How would you design a database schema for a social media platform?
2,What is the difference between SQL and NoSQL databases?
3,What is the TCP/IP protocol and how does it work?
4,What is the difference between a process and a thread?
5,What is a binary tree and how can it be used to store data?
6,What is the difference between an array and a linked list?
7,What are the different types of programming languages and how do they differ?
8,What is Springboot and how is it used?
9,What is HTML5 and how is it used to create web pages?
10,What is the difference between CSS and JavaScript?
11,What is React Js and how is it used to create user interfaces?
12,What is Nodejs and how is it used to create server-side applications?
13,What is Express Js and how is it used to create RESTful APIs?
14,What is Bootstrap and how is it used to create responsive web designs?
15,What is Postman and how is it used for API testing?
16,What is Github and how is it used for version control?
